{
  "lexeme_id": "ORB-LEX-000107",
  "lemma": "nirm",
  "status": "canonical",
  "eingefuehrt_in": "grammar-0.9.3",
  "letzte_aenderung": "2026-08-16",
  "wortart": "adjektiv",
  "grammatische_kategorie": null,
  "register": "neutral",
  "haeufigkeit": "UNRATED",
  "produktivitaet": "produktiv",
  "domaenen": [
    "raum"
  ],
  "lernstufe": "unbestimmt",
  "de": {
    "short": "klein",
    "definition": "klein. Attributiv dekliniert (Stamm + r/l/n + a + Marker), praedikativ in der Grundform (§12.1–§12.2); Adverb auf -un (§12.4). (Migrierte Woerterbuchglosse aus §24.7; ausformulierte Definition steht aus.)",
    "alternativen": [],
    "gebrauchshinweis": null
  },
  "en": {
    "short": "small",
    "definition": null,
    "alternativen": [],
    "usage_note": null,
    "status": "derived"
  },
  "grammatik": {
    "steigerung": {
      "komparativ": "nirmvi",
      "superlativ": "nirmvax"
    },
    "kasusformen": {
      "M_nom_sg": "nirmra",
      "M_nom_pl": "nirmrañ",
      "M_akk_sg": "nirmran",
      "M_akk_pl": "nirmrañan",
      "M_dat_sg": "nirmraş",
      "M_dat_pl": "nirmrañaş",
      "M_gen_sg": "nirmras",
      "M_gen_pl": "nirmrañas",
      "F_nom_sg": "nirmla",
      "F_nom_pl": "nirmlañ",
      "F_akk_sg": "nirmlan",
      "F_akk_pl": "nirmlañan",
      "F_dat_sg": "nirmlaş",
      "F_dat_pl": "nirmlañaş",
      "F_gen_sg": "nirmlas",
      "F_gen_pl": "nirmlañas",
      "N_nom_sg": "nirmna",
      "N_nom_pl": "nirmnañ",
      "N_akk_sg": "nirmnan",
      "N_akk_pl": "nirmnañan",
      "N_dat_sg": "nirmnaş",
      "N_dat_pl": "nirmnañaş",
      "N_gen_sg": "nirmnas",
      "N_gen_pl": "nirmnañas"
    }
  },
  "phonologie": {
    "phonemfolge": [
      "n",
      "i",
      "r",
      "m"
    ],
    "ipa": null,
    "silbifizierung": [
      "nirm"
    ],
    "silbifizierung_kandidaten": null,
    "betonung": null,
    "phonotaktik_status": "ok"
  },
  "manus": {
    "silben": [
      "nirm"
    ],
    "kompositionsdaten": null,
    "status": "provisional",
    "ambiguitaet": false,
    "ambiguitaet_anzahl": null,
    "befund": null
  },
  "semantik": {
    "concept_ids": [
      "ORB-CON-000107"
    ],
    "synonyme": [],
    "relationen": [
      {
        "typ": "antonym",
        "ziel": "ORB-LEX-000106",
        "anmerkung_de": "Gegensatzpaar aus dem Adjektivbestand §24.7."
      }
    ],
    "konnotation": null,
    "bedeutungsnuancen": []
  },
  "wortfamilie": {
    "wurzel": null,
    "family_id": null,
    "abgeleitete": [],
    "komposita": [],
    "verwandte_wurzeln": []
  },
  "etymologie": {
    "status": "unknown",
    "proto_form": null,
    "zwischenformen": [],
    "lautgesetze": [],
    "bedeutungsentwicklung": null,
    "besonderheiten": null
  },
  "gebrauch": {
    "kollokationen": [],
    "typische_konstruktionen": [],
    "typische_praepositionen": [],
    "typische_objekte": [],
    "typische_subjekte": [],
    "stil": null,
    "bereich": null
  },
  "beispiele": [],
  "qualitaet": {
    "geprueft": true,
    "validatorstatus": "ok",
    "offene_befunde": [
      "W-04"
    ],
    "letzte_pruefung": "2026-08-16",
    "quelle": "§24.7"
  }
}
