{
  "lexeme_id": "ORB-LEX-000121",
  "lemma": "zilv",
  "status": "canonical",
  "eingefuehrt_in": "grammar-0.9.3",
  "letzte_aenderung": "2026-08-16",
  "wortart": "adjektiv",
  "grammatische_kategorie": null,
  "register": "neutral",
  "haeufigkeit": "UNRATED",
  "produktivitaet": "produktiv",
  "domaenen": [
    "bewegung"
  ],
  "lernstufe": "unbestimmt",
  "de": {
    "short": "schnell",
    "definition": "schnell. Attributiv dekliniert (Stamm + r/l/n + a + Marker), praedikativ in der Grundform (§12.1–§12.2); Adverb auf -un (§12.4). (Migrierte Woerterbuchglosse aus §24.7; ausformulierte Definition steht aus.)",
    "alternativen": [],
    "gebrauchshinweis": null
  },
  "en": {
    "short": "fast",
    "definition": null,
    "alternativen": [],
    "usage_note": null,
    "status": "derived"
  },
  "grammatik": {
    "steigerung": {
      "komparativ": "zilvi",
      "superlativ": "zilvax"
    },
    "kasusformen": {
      "M_nom_sg": "zilvra",
      "M_nom_pl": "zilvrañ",
      "M_akk_sg": "zilvran",
      "M_akk_pl": "zilvrañan",
      "M_dat_sg": "zilvraş",
      "M_dat_pl": "zilvrañaş",
      "M_gen_sg": "zilvras",
      "M_gen_pl": "zilvrañas",
      "F_nom_sg": "zilvla",
      "F_nom_pl": "zilvlañ",
      "F_akk_sg": "zilvlan",
      "F_akk_pl": "zilvlañan",
      "F_dat_sg": "zilvlaş",
      "F_dat_pl": "zilvlañaş",
      "F_gen_sg": "zilvlas",
      "F_gen_pl": "zilvlañas",
      "N_nom_sg": "zilvna",
      "N_nom_pl": "zilvnañ",
      "N_akk_sg": "zilvnan",
      "N_akk_pl": "zilvnañan",
      "N_dat_sg": "zilvnaş",
      "N_dat_pl": "zilvnañaş",
      "N_gen_sg": "zilvnas",
      "N_gen_pl": "zilvnañas"
    }
  },
  "phonologie": {
    "phonemfolge": [
      "z",
      "i",
      "l",
      "v"
    ],
    "ipa": null,
    "silbifizierung": [
      "zilv"
    ],
    "silbifizierung_kandidaten": null,
    "betonung": null,
    "phonotaktik_status": "ok"
  },
  "manus": {
    "silben": [
      "zilv"
    ],
    "kompositionsdaten": null,
    "status": "provisional",
    "ambiguitaet": false,
    "ambiguitaet_anzahl": null,
    "befund": null
  },
  "semantik": {
    "concept_ids": [
      "ORB-CON-000121"
    ],
    "synonyme": [],
    "relationen": [
      {
        "typ": "antonym",
        "ziel": "ORB-LEX-000122",
        "anmerkung_de": "Gegensatzpaar aus dem Adjektivbestand §24.7."
      }
    ],
    "konnotation": null,
    "bedeutungsnuancen": []
  },
  "wortfamilie": {
    "wurzel": null,
    "family_id": null,
    "abgeleitete": [],
    "komposita": [],
    "verwandte_wurzeln": []
  },
  "etymologie": {
    "status": "unknown",
    "proto_form": null,
    "zwischenformen": [],
    "lautgesetze": [],
    "bedeutungsentwicklung": null,
    "besonderheiten": null
  },
  "gebrauch": {
    "kollokationen": [],
    "typische_konstruktionen": [],
    "typische_praepositionen": [],
    "typische_objekte": [],
    "typische_subjekte": [],
    "stil": null,
    "bereich": null
  },
  "beispiele": [],
  "qualitaet": {
    "geprueft": true,
    "validatorstatus": "ok",
    "offene_befunde": [
      "W-04"
    ],
    "letzte_pruefung": "2026-08-16",
    "quelle": "§24.7"
  }
}
