{
  "lexeme_id": "ORB-LEX-000017",
  "lemma": "soralm",
  "status": "canonical",
  "eingefuehrt_in": "grammar-0.9.3",
  "letzte_aenderung": "2026-08-16",
  "wortart": "nomen",
  "grammatische_kategorie": "10prozent",
  "register": "neutral",
  "haeufigkeit": "STANDARD",
  "produktivitaet": "unbekannt",
  "domaenen": [
    "kultur"
  ],
  "lernstufe": "unbestimmt",
  "de": {
    "short": "Denkmal",
    "definition": "Denkmal. Gehoert zur 10-Prozent-Gruppe (F): Endvokal geschwunden, Singular mit Bindevokal -e-; der Plural ist nicht geregelt (L-07). (Migrierte Woerterbuchglosse aus §10.1; ausformulierte Definition steht aus.)",
    "alternativen": [],
    "gebrauchshinweis": null
  },
  "en": {
    "short": "monument",
    "definition": null,
    "alternativen": [],
    "usage_note": null,
    "status": "derived"
  },
  "grammatik": {
    "genus": "F",
    "klasse": "10prozent",
    "unterklasse": null,
    "themavokal": null,
    "deklination": "10prozent",
    "kasusformen": {
      "nom_sg": "soralm",
      "akk_sg": "soralmen",
      "dat_sg": "soralmeş",
      "gen_sg": "soralmes"
    },
    "plural": null
  },
  "phonologie": {
    "phonemfolge": [
      "s",
      "o",
      "r",
      "a",
      "l",
      "m"
    ],
    "ipa": null,
    "silbifizierung": [
      "so",
      "ralm"
    ],
    "silbifizierung_kandidaten": null,
    "betonung": null,
    "phonotaktik_status": "ok"
  },
  "manus": {
    "silben": [
      "so",
      "ralm"
    ],
    "kompositionsdaten": null,
    "status": "provisional",
    "ambiguitaet": false,
    "ambiguitaet_anzahl": null,
    "befund": null
  },
  "semantik": {
    "concept_ids": [
      "ORB-CON-000017"
    ],
    "synonyme": [],
    "relationen": [],
    "konnotation": null,
    "bedeutungsnuancen": []
  },
  "wortfamilie": {
    "wurzel": null,
    "family_id": null,
    "abgeleitete": [],
    "komposita": [],
    "verwandte_wurzeln": []
  },
  "etymologie": {
    "status": "unknown",
    "proto_form": null,
    "zwischenformen": [],
    "lautgesetze": [],
    "bedeutungsentwicklung": null,
    "besonderheiten": null
  },
  "gebrauch": {
    "kollokationen": [],
    "typische_konstruktionen": [],
    "typische_praepositionen": [],
    "typische_objekte": [],
    "typische_subjekte": [],
    "stil": null,
    "bereich": null
  },
  "beispiele": [],
  "qualitaet": {
    "geprueft": true,
    "validatorstatus": "befund",
    "offene_befunde": [
      "L-07",
      "W-04"
    ],
    "letzte_pruefung": "2026-08-16",
    "quelle": "§10.1"
  }
}
