{
  "lexeme_id": "ORB-LEX-000266",
  "lemma": "xna",
  "status": "canonical",
  "eingefuehrt_in": "grammar-0.9.3",
  "letzte_aenderung": "2026-08-16",
  "wortart": "artikel",
  "grammatische_kategorie": "bestimmt",
  "register": "neutral",
  "haeufigkeit": "CORE",
  "produktivitaet": "unbekannt",
  "domaenen": [
    "grammatik"
  ],
  "lernstufe": "unbestimmt",
  "de": {
    "short": "Artikel bestimmt N nom sg",
    "definition": "Artikel bestimmt N nom sg. Zeigt nur Geschlecht, nie die Unterklasse (§11.3). (Migrierte Woerterbuchglosse aus §11; ausformulierte Definition steht aus.)",
    "alternativen": [],
    "gebrauchshinweis": null
  },
  "en": {
    "short": "definite article, neuter nominative singular",
    "definition": null,
    "alternativen": [],
    "usage_note": null,
    "status": "derived"
  },
  "grammatik": {
    "genus": "N",
    "kasusformen": {
      "nom_sg": "xna"
    }
  },
  "phonologie": {
    "phonemfolge": [
      "x",
      "n",
      "a"
    ],
    "ipa": null,
    "silbifizierung": [
      "xna"
    ],
    "silbifizierung_kandidaten": null,
    "betonung": null,
    "phonotaktik_status": "ok"
  },
  "manus": {
    "silben": [
      "xna"
    ],
    "kompositionsdaten": null,
    "status": "provisional",
    "ambiguitaet": false,
    "ambiguitaet_anzahl": null,
    "befund": null
  },
  "semantik": {
    "concept_ids": [],
    "synonyme": [],
    "relationen": [],
    "konnotation": null,
    "bedeutungsnuancen": []
  },
  "wortfamilie": {
    "wurzel": null,
    "family_id": null,
    "abgeleitete": [],
    "komposita": [],
    "verwandte_wurzeln": []
  },
  "etymologie": {
    "status": "unknown",
    "proto_form": null,
    "zwischenformen": [],
    "lautgesetze": [],
    "bedeutungsentwicklung": null,
    "besonderheiten": null
  },
  "gebrauch": {
    "kollokationen": [],
    "typische_konstruktionen": [],
    "typische_praepositionen": [],
    "typische_objekte": [],
    "typische_subjekte": [],
    "stil": null,
    "bereich": null
  },
  "beispiele": [],
  "qualitaet": {
    "geprueft": true,
    "validatorstatus": "ok",
    "offene_befunde": [
      "W-04"
    ],
    "letzte_pruefung": "2026-08-16",
    "quelle": "§11"
  }
}
