{
  "lexeme_id": "ORB-LEX-000105",
  "lemma": "dalv",
  "status": "canonical",
  "eingefuehrt_in": "grammar-0.9.3",
  "letzte_aenderung": "2026-08-16",
  "wortart": "verb",
  "grammatische_kategorie": "unregelmaessig",
  "register": "neutral",
  "haeufigkeit": "CORE",
  "produktivitaet": "produktiv",
  "domaenen": [
    "beziehungen"
  ],
  "lernstufe": "unbestimmt",
  "de": {
    "short": "geben",
    "definition": "geben. Unregelmaessiges Verb; die belegten Tabellen sind massgeblich, die Formelbeschreibung in §15.2 deckt sie nicht vollstaendig (U-01). (Migrierte Woerterbuchglosse aus §15.2; ausformulierte Definition steht aus.)",
    "alternativen": [],
    "gebrauchshinweis": null
  },
  "en": {
    "short": "to give",
    "definition": null,
    "alternativen": [],
    "usage_note": null,
    "status": "derived"
  },
  "grammatik": {
    "verbwurzel": "dalv",
    "konjugationsklasse": "unregelmaessig",
    "infinitiv": "dalvex",
    "partizip": "dalvut",
    "unregelmaessige_formen": {
      "praesens": {
        "1sg": "dalvam",
        "2sg": "dalvaş",
        "3sg": "dalvat",
        "1pl": "dalvamen",
        "2pl": "dalvaşen",
        "3pl": "dalvaten"
      },
      "vergangenheit": {
        "1sg": "dolvem",
        "2sg": "dolveş",
        "3sg": "dolvet",
        "1pl": "dolvemen",
        "2pl": "dolveşen",
        "3pl": "dolveten"
      },
      "zukunft": {
        "1sg": "dalvaim",
        "2sg": "dalvaiş",
        "3sg": "dalvait",
        "1pl": "dalvaimen",
        "2pl": "dalvaişen",
        "3pl": "dalvaiten"
      }
    }
  },
  "phonologie": {
    "phonemfolge": [
      "d",
      "a",
      "l",
      "v"
    ],
    "ipa": null,
    "silbifizierung": [
      "dalv"
    ],
    "silbifizierung_kandidaten": null,
    "betonung": null,
    "phonotaktik_status": "ok"
  },
  "manus": {
    "silben": [
      "dalv"
    ],
    "kompositionsdaten": null,
    "status": "provisional",
    "ambiguitaet": false,
    "ambiguitaet_anzahl": null,
    "befund": null
  },
  "semantik": {
    "concept_ids": [
      "ORB-CON-000105"
    ],
    "synonyme": [],
    "relationen": [],
    "konnotation": null,
    "bedeutungsnuancen": []
  },
  "wortfamilie": {
    "wurzel": null,
    "family_id": null,
    "abgeleitete": [],
    "komposita": [],
    "verwandte_wurzeln": []
  },
  "etymologie": {
    "status": "unknown",
    "proto_form": null,
    "zwischenformen": [],
    "lautgesetze": [],
    "bedeutungsentwicklung": null,
    "besonderheiten": null
  },
  "gebrauch": {
    "kollokationen": [],
    "typische_konstruktionen": [],
    "typische_praepositionen": [],
    "typische_objekte": [],
    "typische_subjekte": [],
    "stil": null,
    "bereich": null
  },
  "beispiele": [],
  "qualitaet": {
    "geprueft": true,
    "validatorstatus": "befund",
    "offene_befunde": [
      "U-01",
      "W-04"
    ],
    "letzte_pruefung": "2026-08-16",
    "quelle": "§15.2"
  }
}
