{
  "lexeme_id": "ORB-LEX-000153",
  "lemma": "kem",
  "status": "canonical",
  "eingefuehrt_in": "grammar-0.9.3",
  "letzte_aenderung": "2026-08-16",
  "wortart": "pronomen",
  "grammatische_kategorie": "fragewort",
  "register": "neutral",
  "haeufigkeit": "VERY_COMMON",
  "produktivitaet": "unbekannt",
  "domaenen": [
    "grammatik"
  ],
  "lernstufe": "unbestimmt",
  "de": {
    "short": "wer",
    "definition": "wer. Fragewort; steht auf Position 1, das finite Verb folgt (§18.2). Kasusformen sind nicht definiert (L-03). (Migrierte Woerterbuchglosse aus §18.2; ausformulierte Definition steht aus.)",
    "alternativen": [],
    "gebrauchshinweis": null
  },
  "en": {
    "short": "who",
    "definition": null,
    "alternativen": [],
    "usage_note": null,
    "status": "derived"
  },
  "grammatik": {},
  "phonologie": {
    "phonemfolge": [
      "k",
      "e",
      "m"
    ],
    "ipa": null,
    "silbifizierung": [
      "kem"
    ],
    "silbifizierung_kandidaten": null,
    "betonung": null,
    "phonotaktik_status": "ok"
  },
  "manus": {
    "silben": [
      "kem"
    ],
    "kompositionsdaten": null,
    "status": "provisional",
    "ambiguitaet": false,
    "ambiguitaet_anzahl": null,
    "befund": null
  },
  "semantik": {
    "concept_ids": [
      "ORB-CON-000126"
    ],
    "synonyme": [],
    "relationen": [],
    "konnotation": null,
    "bedeutungsnuancen": []
  },
  "wortfamilie": {
    "wurzel": null,
    "family_id": null,
    "abgeleitete": [],
    "komposita": [],
    "verwandte_wurzeln": []
  },
  "etymologie": {
    "status": "unknown",
    "proto_form": null,
    "zwischenformen": [],
    "lautgesetze": [],
    "bedeutungsentwicklung": null,
    "besonderheiten": null
  },
  "gebrauch": {
    "kollokationen": [],
    "typische_konstruktionen": [],
    "typische_praepositionen": [],
    "typische_objekte": [],
    "typische_subjekte": [],
    "stil": null,
    "bereich": null
  },
  "beispiele": [],
  "qualitaet": {
    "geprueft": true,
    "validatorstatus": "befund",
    "offene_befunde": [
      "L-03",
      "W-04"
    ],
    "letzte_pruefung": "2026-08-16",
    "quelle": "§18.2"
  }
}
