{
  "lexeme_id": "ORB-LEX-000149",
  "lemma": "şlani",
  "status": "canonical",
  "eingefuehrt_in": "grammar-0.9.3",
  "letzte_aenderung": "2026-08-16",
  "wortart": "konjunktion",
  "grammatische_kategorie": "unterordnend",
  "register": "neutral",
  "haeufigkeit": "VERY_COMMON",
  "produktivitaet": "unbekannt",
  "domaenen": [
    "grammatik"
  ],
  "lernstufe": "unbestimmt",
  "de": {
    "short": "obwohl",
    "definition": "obwohl. Unterordnend; loest Verbendstellung aus (§17.2). (Migrierte Woerterbuchglosse aus §20; ausformulierte Definition steht aus.)",
    "alternativen": [],
    "gebrauchshinweis": null
  },
  "en": {
    "short": "although",
    "definition": null,
    "alternativen": [],
    "usage_note": null,
    "status": "derived"
  },
  "grammatik": {},
  "phonologie": {
    "phonemfolge": [
      "ş",
      "l",
      "a",
      "n",
      "i"
    ],
    "ipa": null,
    "silbifizierung": null,
    "silbifizierung_kandidaten": [
      "şla·ni",
      "şlan·i"
    ],
    "betonung": null,
    "phonotaktik_status": "ok"
  },
  "manus": {
    "silben": null,
    "kompositionsdaten": null,
    "status": "blocked",
    "ambiguitaet": true,
    "ambiguitaet_anzahl": 2,
    "befund": "L-09"
  },
  "semantik": {
    "concept_ids": [],
    "synonyme": [],
    "relationen": [],
    "konnotation": null,
    "bedeutungsnuancen": []
  },
  "wortfamilie": {
    "wurzel": null,
    "family_id": null,
    "abgeleitete": [],
    "komposita": [],
    "verwandte_wurzeln": []
  },
  "etymologie": {
    "status": "unknown",
    "proto_form": null,
    "zwischenformen": [],
    "lautgesetze": [],
    "bedeutungsentwicklung": null,
    "besonderheiten": null
  },
  "gebrauch": {
    "kollokationen": [],
    "typische_konstruktionen": [],
    "typische_praepositionen": [],
    "typische_objekte": [],
    "typische_subjekte": [],
    "stil": null,
    "bereich": null
  },
  "beispiele": [],
  "qualitaet": {
    "geprueft": true,
    "validatorstatus": "befund",
    "offene_befunde": [
      "L-09",
      "W-04"
    ],
    "letzte_pruefung": "2026-08-16",
    "quelle": "§20"
  }
}
